{
  "$schema": "https://json-schema.org/draft/2020-12/schema",
  "$id": "fixture-envelope.schema.json",
  "title": "Agent Golden Plane Fixture Envelope v1",
  "type": "object",
  "additionalProperties": false,
  "required": [
    "schema_version", "fixture_set", "scenario_id", "variant_id", "plane", "applicability",
    "payload_schema", "normalization_profile", "source", "legacy_field_observation",
    "content_hash", "joins", "happens_before"
  ],
  "properties": {
    "schema_version": {"const": "1.0"},
    "fixture_set": {"enum": ["legacy_characterization", "contract_v1"]},
    "scenario_id": {"type": "string", "pattern": "^GT[0-9]{2}$"},
    "variant_id": {"type": "string", "pattern": "^GT[0-9]{2}-[a-z0-9-]+$"},
    "plane": {"enum": ["provider", "domain", "sse", "db_events", "conversation"]},
    "applicability": {"enum": ["required", "not_applicable", "deferred"]},
    "payload_schema": {"type": ["string", "null"]},
    "normalization_profile": {"const": "agent-golden-v1"},
    "source": {
      "type": "object",
      "additionalProperties": false,
      "required": ["kind", "repo_revision", "artifacts", "capture_harness"],
      "properties": {
        "kind": {"enum": ["captured_runtime", "target_contract", "explicit_manifest"]},
        "repo_revision": {"type": "string", "pattern": "^[a-f0-9]{40}$"},
        "artifacts": {
          "type": "array",
          "uniqueItems": true,
          "items": {
            "type": "object",
            "additionalProperties": false,
            "required": ["path", "sha256"],
            "properties": {
              "path": {"type": "string", "minLength": 1},
              "sha256": {"type": "string", "pattern": "^sha256:[a-f0-9]{64}$"}
            }
          }
        },
        "capture_harness": {"type": ["string", "null"]}
      }
    },
    "legacy_field_observation": {
      "type": "object",
      "additionalProperties": {"enum": ["present", "absent"]}
    },
    "payload": {"not": {"type": "null"}},
    "omission": {
      "type": "object",
      "additionalProperties": false,
      "required": ["reason"],
      "properties": {"reason": {"type": "string", "minLength": 1}}
    },
    "content_hash": {"type": ["string", "null"], "pattern": "^(sha256:[a-f0-9]{64})?$"},
    "joins": {
      "type": "array",
      "items": {
        "type": "object",
        "additionalProperties": false,
        "required": ["name", "rule_id", "references"],
        "properties": {
          "name": {"type": "string", "minLength": 1},
          "rule_id": {"type": "string", "pattern": "^[a-z][a-z0-9_.-]+$"},
          "references": {
            "type": "array",
            "minItems": 2,
            "uniqueItems": true,
            "items": {"$ref": "#/$defs/planePointer"}
          }
        }
      }
    },
    "happens_before": {
      "type": "array",
      "items": {
        "type": "object",
        "additionalProperties": false,
        "required": ["name", "rule_id", "order_type", "before", "after"],
        "properties": {
          "name": {"type": "string", "minLength": 1},
          "rule_id": {"type": "string", "pattern": "^[a-z][a-z0-9_.-]+$"},
          "order_type": {"enum": ["integer", "number", "rfc3339"]},
          "before": {"$ref": "#/$defs/planePointer"},
          "after": {"$ref": "#/$defs/planePointer"}
        }
      }
    },
    "notes": {"type": "array", "items": {"type": "string"}}
  },
  "$defs": {
    "planePointer": {
      "type": "object",
      "additionalProperties": false,
      "required": ["role", "plane", "pointer"],
      "properties": {
        "role": {"type": "string", "pattern": "^[a-z][a-z0-9_]*$"},
        "plane": {"enum": ["provider", "domain", "sse", "db_events", "conversation"]},
        "pointer": {
          "type": "string",
          "pattern": "^(?:/(?:[^~/]|~[01])*)*$"
        }
      }
    }
  },
  "allOf": [
    {
      "if": {"properties": {"applicability": {"const": "required"}}, "required": ["applicability"]},
      "then": {"required": ["payload"], "not": {"required": ["omission"]}, "properties": {"payload_schema": {"type": "string", "minLength": 1}, "content_hash": {"type": "string", "pattern": "^sha256:[a-f0-9]{64}$"}}}
    },
    {
      "if": {"properties": {"applicability": {"enum": ["not_applicable", "deferred"]}}, "required": ["applicability"]},
      "then": {"required": ["omission"], "not": {"required": ["payload"]}, "properties": {"payload_schema": {"type": "null"}, "content_hash": {"type": "null"}, "source": {"properties": {"kind": {"const": "explicit_manifest"}}}}}
    }
  ]
}
