{
  "schema_version": "1.0",
  "fixture_set": "legacy_characterization",
  "scenario_id": "GT01",
  "variant_id": "GT01-sync",
  "plane": "conversation",
  "applicability": "required",
  "payload_schema": "planes/conversation.schema.json",
  "normalization_profile": "agent-golden-v1",
  "source": {
    "kind": "captured_runtime",
    "repo_revision": "6c6594d42c08ae3757a72aa0e654a3fe555e4077",
    "artifacts": [
      {
        "path": "backend/tests/agent_golden/fixture_writer.py",
        "sha256": "sha256:2142c79df0157a7e799a261dbd07196e045640befc550f0d252e10cbcc57833a"
      },
      {
        "path": "backend/tests/agent_golden/legacy_scenario_capture.py",
        "sha256": "sha256:abdd3e6f8c37fc756b3ce30026b0883dad638276fdd7068e8b85256887988a46"
      },
      {
        "path": "backend/tests/agent_golden/harness.py",
        "sha256": "sha256:11608df79f9b8576d09262931838b8b2a3905a369abef66cdeb67dcc37d0defd"
      },
      {
        "path": "backend/tests/agent_golden/support.py",
        "sha256": "sha256:e3340322640c70fd35ad0999b31ec0ac8584453301f8f99f0cc768b6ef63e999"
      },
      {
        "path": "backend/tests/agent_golden/scripted_dependencies.py",
        "sha256": "sha256:3212379f91898a9d79d50d7e602d1666ad51d4b9fa1dd121bfaee054fa88c1f6"
      },
      {
        "path": "contracts/agent/v1/normalization-profiles.json",
        "sha256": "sha256:79323752976e1cde514dd0b912351c337d126ac32330f7767c1eea6a13aa4256"
      },
      {
        "path": "contracts/agent/v1/scenario-catalog.json",
        "sha256": "sha256:9725d8e215fd2b528f0c8bc71a0ca007fa2c60b159856241f9f4ce2dd5fd3daa"
      }
    ],
    "capture_harness": "agent_golden.fixture_writer.capture_legacy_envelopes"
  },
  "legacy_field_observation": {
    "interaction_id": "absent",
    "run_id": "absent"
  },
  "content_hash": "sha256:e98599e89eaa04cf73d2a53e19123fa08c68c4c4371e5183891273b6158f3240",
  "joins": [],
  "happens_before": [],
  "payload": {
    "sync_response": {
      "reply": "这是 Golden 测试的稳定回复。",
      "session_id": "<id:0002>",
      "router_decision": {
        "decision": "answer_only",
        "selected_task_id": null,
        "target_skill_id": null,
        "target_step_id": null,
        "confidence": 0.0,
        "user_intent": null,
        "general_intent": null,
        "reason": "No published scene skills are available; try general skills, then answer as chat.",
        "source_message": null,
        "clarification_question": null,
        "slot_hints": {},
        "task_frames": [],
        "pending_tasks": [],
        "task_updates": [],
        "created_tasks": [],
        "awaiting_input": null
      },
      "step_result": {
        "action": null,
        "reply": null,
        "slot_updates": {},
        "tool_call": null,
        "knowledge_query": null,
        "knowledge_results": [],
        "next_step_id": null,
        "is_step_completed": false,
        "handoff": false
      },
      "tool_result": null,
      "session_state": {
        "session_id": "<id:0002>",
        "tenant_id": "tenant_golden",
        "user_id": "user_golden",
        "agent_id": "agent_golden",
        "title": "你好，请介绍一下自己",
        "active_skill_id": null,
        "active_step_id": null,
        "slots": {},
        "pending_tasks": [],
        "awaiting_input": null,
        "knowledge_context": [],
        "summary": "最近回复：这是 Golden 测试的稳定回复。",
        "last_agent_question": null,
        "status": "active"
      }
    },
    "messages": [
      {
        "id": "<id:0001>",
        "tenant_id": "tenant_golden",
        "session_id": "<id:0002>",
        "role": "user",
        "content": "你好，请介绍一下自己。",
        "metadata": {
          "client_turn_id": "client-gt01-sync"
        },
        "turn_id": "<id:0001>",
        "created_at": "2000-01-01T00:00:00.002Z",
        "feedback_rating": null
      },
      {
        "id": "<id:0003>",
        "tenant_id": "tenant_golden",
        "session_id": "<id:0002>",
        "role": "assistant",
        "content": "这是 Golden 测试的稳定回复。",
        "metadata": {
          "user_message_id": "<id:0001>",
          "turn_id": "<id:0001>"
        },
        "turn_id": "<id:0001>",
        "created_at": "2000-01-01T00:00:00.005Z",
        "feedback_rating": null
      }
    ],
    "session": {
      "id": "<id:0002>",
      "tenant_id": "tenant_golden",
      "user_id": "user_golden",
      "agent_id": "agent_golden",
      "title": "你好，请介绍一下自己",
      "active_skill_id": null,
      "active_step_id": null,
      "status": "active",
      "summary": "最近回复：这是 Golden 测试的稳定回复。",
      "last_agent_question": null,
      "is_scheduled": false,
      "created_at": "2000-01-01T00:00:00.001Z",
      "updated_at": "2000-01-01T00:00:00.004Z"
    },
    "interaction_checks": [
      {
        "kind": "none",
        "realtime_observation": "not_observed",
        "refresh_observation": "not_observed",
        "action_result": null
      }
    ]
  }
}
