{
  "schema_version": "1.0",
  "fixture_set": "legacy_characterization",
  "scenario_id": "GT16",
  "variant_id": "GT16-history",
  "plane": "domain",
  "applicability": "required",
  "payload_schema": "planes/domain.schema.json",
  "normalization_profile": "agent-golden-v1",
  "source": {
    "kind": "captured_runtime",
    "repo_revision": "6c6594d42c08ae3757a72aa0e654a3fe555e4077",
    "artifacts": [
      {
        "path": "backend/tests/agent_golden/fixture_writer.py",
        "sha256": "sha256:2142c79df0157a7e799a261dbd07196e045640befc550f0d252e10cbcc57833a"
      },
      {
        "path": "backend/tests/agent_golden/legacy_scenario_capture.py",
        "sha256": "sha256:abdd3e6f8c37fc756b3ce30026b0883dad638276fdd7068e8b85256887988a46"
      },
      {
        "path": "backend/tests/agent_golden/harness.py",
        "sha256": "sha256:11608df79f9b8576d09262931838b8b2a3905a369abef66cdeb67dcc37d0defd"
      },
      {
        "path": "backend/tests/agent_golden/support.py",
        "sha256": "sha256:e3340322640c70fd35ad0999b31ec0ac8584453301f8f99f0cc768b6ef63e999"
      },
      {
        "path": "backend/tests/agent_golden/scripted_dependencies.py",
        "sha256": "sha256:3212379f91898a9d79d50d7e602d1666ad51d4b9fa1dd121bfaee054fa88c1f6"
      },
      {
        "path": "contracts/agent/v1/normalization-profiles.json",
        "sha256": "sha256:79323752976e1cde514dd0b912351c337d126ac32330f7767c1eea6a13aa4256"
      },
      {
        "path": "contracts/agent/v1/scenario-catalog.json",
        "sha256": "sha256:9725d8e215fd2b528f0c8bc71a0ca007fa2c60b159856241f9f4ce2dd5fd3daa"
      }
    ],
    "capture_harness": "agent_golden.fixture_writer.capture_legacy_envelopes"
  },
  "legacy_field_observation": {
    "interaction_id": "absent",
    "run_id": "absent"
  },
  "content_hash": "sha256:8bc6454d4a39101fd5500a528b11494ac832bd6875bfa3b94a323401729347d2",
  "joins": [
    {
      "name": "user-turn-message-identity",
      "rule_id": "legacy.turn_message_identity",
      "references": [
        {
          "role": "domain_turn_id",
          "plane": "domain",
          "pointer": "/request/turn_id"
        },
        {
          "role": "db_user_message_id",
          "plane": "db_events",
          "pointer": "/events/1/payload/message_id"
        },
        {
          "role": "conversation_user_message_id",
          "plane": "conversation",
          "pointer": "/messages/0/id"
        }
      ]
    },
    {
      "name": "assistant-message-identity",
      "rule_id": "legacy.turn_message_identity",
      "references": [
        {
          "role": "domain_assistant_message_id",
          "plane": "domain",
          "pointer": "/outcome/assistant_message_id"
        },
        {
          "role": "db_assistant_message_id",
          "plane": "db_events",
          "pointer": "/events/7/payload/message_id"
        },
        {
          "role": "conversation_assistant_message_id",
          "plane": "conversation",
          "pointer": "/messages/1/id"
        }
      ]
    },
    {
      "name": "attachment-upload-request-history-identity",
      "rule_id": "legacy.attachment_identity",
      "references": [
        {
          "role": "domain_request_attachment_id",
          "plane": "domain",
          "pointer": "/request/attachments/0/id"
        },
        {
          "role": "conversation_message_attachment_id",
          "plane": "conversation",
          "pointer": "/messages/0/metadata/attachments/0/id"
        },
        {
          "role": "action_persisted_attachment_id",
          "plane": "conversation",
          "pointer": "/interaction_checks/0/action_result/persisted_state/attachment/id"
        }
      ]
    }
  ],
  "happens_before": [],
  "payload": {
    "request": {
      "tenant_id": "tenant_golden",
      "agent_id": "agent_golden",
      "message": "请总结附件。",
      "client_turn_id": "client-attachment",
      "turn_id": "<id:0001>",
      "attachments": [
        {
          "id": "<id:0002>",
          "filename": "golden-notes.txt",
          "content_type": "text/plain",
          "size": 19,
          "kind": "text",
          "text": "第一行\n第二行",
          "preview": "第一行\n第二行",
          "data_url": null,
          "python_summary": "文件 golden-notes.txt，19 bytes，MIME text/plain。 解析得到 7 个字符、2 行、约 2 个词。",
          "error": null
        }
      ]
    },
    "router_decision": {
      "decision": "answer_only",
      "selected_task_id": null,
      "target_skill_id": null,
      "target_step_id": null,
      "confidence": 0.0,
      "user_intent": null,
      "general_intent": null,
      "reason": "No published scene skills are available; answer as chat.",
      "source_message": null,
      "clarification_question": null,
      "slot_hints": {},
      "task_frames": [],
      "pending_tasks": [],
      "task_updates": [],
      "created_tasks": [],
      "awaiting_input": null
    },
    "step_result": {
      "action": null,
      "reply": null,
      "slot_updates": {},
      "tool_call": null,
      "knowledge_query": null,
      "knowledge_results": [],
      "next_step_id": null,
      "is_step_completed": false,
      "handoff": false
    },
    "tool_result": null,
    "outcome": {
      "reply": "这是 Golden 测试的稳定回复。",
      "session_id": "<id:0003>",
      "assistant_message_id": "<id:0004>"
    },
    "facts": [],
    "termination": "complete"
  }
}
