{
  "schema_version": "1.0",
  "fixture_set": "legacy_characterization",
  "scenario_id": "GT01",
  "variant_id": "GT01-feedback-refresh-toggle",
  "plane": "conversation",
  "applicability": "required",
  "payload_schema": "planes/conversation.schema.json",
  "normalization_profile": "agent-golden-v1",
  "source": {
    "kind": "captured_runtime",
    "repo_revision": "2a36d3fad208af0ce0d6cfb3bc946d9e858d6145",
    "artifacts": [
      {
        "path": "backend/tests/agent_golden/fixture_writer.py",
        "sha256": "sha256:3784feb44fdc4fb4ee6b54a5ea420d453e82f4d5aaf33e55501b57d2ac118c96"
      },
      {
        "path": "backend/tests/agent_golden/legacy_scenario_capture.py",
        "sha256": "sha256:dafdaa57a89d13163bb61bde9586583ac6d8c9811a7d59b68208c4115115dbc5"
      },
      {
        "path": "backend/tests/agent_golden/harness.py",
        "sha256": "sha256:40f771c8c3ccc1cf59edb2759d04f4ac45de48996583253ffa7038faec128f6b"
      },
      {
        "path": "backend/tests/agent_golden/support.py",
        "sha256": "sha256:dc35bef1b0256844800b6398aa667f08627f1116b768bc710a010331e71c0b94"
      },
      {
        "path": "backend/tests/agent_golden/scripted_dependencies.py",
        "sha256": "sha256:3212379f91898a9d79d50d7e602d1666ad51d4b9fa1dd121bfaee054fa88c1f6"
      },
      {
        "path": "contracts/agent/v1/normalization-profiles.json",
        "sha256": "sha256:2be3a2ad27f6ff312b7ca4b90917eb5cb6c38fd3b401ab7e9a61fea5d0628955"
      },
      {
        "path": "contracts/agent/v1/scenario-catalog.json",
        "sha256": "sha256:9725d8e215fd2b528f0c8bc71a0ca007fa2c60b159856241f9f4ce2dd5fd3daa"
      }
    ],
    "capture_harness": "agent_golden.fixture_writer.capture_legacy_envelopes"
  },
  "legacy_field_observation": {
    "interaction_id": "absent",
    "run_id": "absent"
  },
  "content_hash": "sha256:645766132b3c8805304a396ac032dff1de4449ce574639a97e73843a3944cf61",
  "joins": [
    {
      "name": "feedback-target-message-identity",
      "rule_id": "legacy.feedback_target_identity",
      "references": [
        {
          "role": "conversation_assistant_message_id",
          "plane": "conversation",
          "pointer": "/messages/1/id"
        },
        {
          "role": "action_feedback_target_id",
          "plane": "conversation",
          "pointer": "/interaction_checks/0/action_result/resource_id"
        },
        {
          "role": "feedback_response_message_id",
          "plane": "conversation",
          "pointer": "/interaction_checks/0/action_result/persisted_state/up_response/message_id"
        }
      ]
    }
  ],
  "happens_before": [],
  "payload": {
    "sync_response": {
      "reply": "这是 Golden 测试的稳定回复。",
      "session_id": "<id:0002>",
      "router_decision": {
        "decision": "answer_only",
        "selected_task_id": null,
        "target_skill_id": null,
        "target_step_id": null,
        "confidence": 0.0,
        "user_intent": null,
        "general_intent": null,
        "reason": "No published scene skills are available; try general skills, then answer as chat.",
        "source_message": null,
        "clarification_question": null,
        "slot_hints": {},
        "task_frames": [],
        "pending_tasks": [],
        "task_updates": [],
        "created_tasks": [],
        "awaiting_input": null
      },
      "step_result": {
        "action": null,
        "reply": null,
        "slot_updates": {},
        "tool_call": null,
        "knowledge_query": null,
        "knowledge_results": [],
        "next_step_id": null,
        "is_step_completed": false,
        "handoff": false
      },
      "tool_result": null,
      "session_state": {
        "session_id": "<id:0002>",
        "tenant_id": "tenant_golden",
        "user_id": "user_golden",
        "agent_id": "agent_golden",
        "title": "请回复后接受评价",
        "active_skill_id": null,
        "active_step_id": null,
        "slots": {},
        "pending_tasks": [],
        "awaiting_input": null,
        "knowledge_context": [],
        "summary": "最近回复：这是 Golden 测试的稳定回复。",
        "last_agent_question": null,
        "status": "active"
      }
    },
    "messages": [
      {
        "id": "<id:0001>",
        "tenant_id": "tenant_golden",
        "session_id": "<id:0002>",
        "role": "user",
        "content": "请回复后接受评价。",
        "metadata": {
          "client_turn_id": "client-feedback"
        },
        "turn_id": "<id:0001>",
        "created_at": "2000-01-01T00:00:00.002Z",
        "feedback_rating": null
      },
      {
        "id": "<id:0003>",
        "tenant_id": "tenant_golden",
        "session_id": "<id:0002>",
        "role": "assistant",
        "content": "这是 Golden 测试的稳定回复。",
        "metadata": {
          "user_message_id": "<id:0001>",
          "turn_id": "<id:0001>"
        },
        "turn_id": "<id:0001>",
        "created_at": "2000-01-01T00:00:00.005Z",
        "feedback_rating": null
      }
    ],
    "session": {
      "id": "<id:0002>",
      "tenant_id": "tenant_golden",
      "user_id": "user_golden",
      "agent_id": "agent_golden",
      "title": "请回复后接受评价",
      "active_skill_id": null,
      "active_step_id": null,
      "status": "active",
      "summary": "最近回复：这是 Golden 测试的稳定回复。",
      "last_agent_question": null,
      "is_scheduled": false,
      "created_at": "2000-01-01T00:00:00.001Z",
      "updated_at": "2000-01-01T00:00:00.004Z"
    },
    "persisted_pre_state": null,
    "persisted_session": {
      "id": "<id:0002>",
      "tenant_id": "tenant_golden",
      "user_id": "user_golden",
      "agent_id": "agent_golden",
      "status": "active",
      "active_skill_id": null,
      "active_step_id": null,
      "slots": {},
      "awaiting_input": null,
      "pending_tasks": [],
      "created_at": "2000-01-01T00:00:00.001Z",
      "updated_at": "2000-01-01T00:00:00.004Z"
    },
    "interaction_checks": [
      {
        "kind": "feedback",
        "realtime_observation": "not_observed",
        "refresh_observation": "history_payload_observed",
        "action_result": {
          "evidence_id": "feedback-up-invalid-clear",
          "evidence_origin": "harness_synthetic",
          "resource_id": "<id:0003>",
          "action": "rate_up_reject_invalid_clear",
          "request": {
            "set_rating": "up",
            "invalid_rating": "invalid",
            "clear": true
          },
          "response_status": 200,
          "persisted_state": {
            "initial_rating": null,
            "up_status": 200,
            "up_response": {
              "id": "<id:0009>",
              "tenant_id": "tenant_golden",
              "session_id": "<id:0002>",
              "message_id": "<id:0003>",
              "rating": "up",
              "analysis_status": "pending",
              "updated_at": "2000-01-01T00:00:00.008Z"
            },
            "rating_after_up_refresh": "up",
            "invalid_status": 422,
            "invalid_response": {
              "detail": [
                {
                  "type": "literal_error",
                  "loc": [
                    "body",
                    "rating"
                  ],
                  "msg": "Input should be 'up' or 'down'",
                  "input": "invalid",
                  "ctx": {
                    "expected": "'up' or 'down'"
                  }
                }
              ]
            },
            "rating_after_invalid_refresh": "up",
            "clear_response": {
              "status": "deleted"
            },
            "rating_after_clear_refresh": null
          }
        }
      }
    ]
  }
}
