{
  "schema_version": "1.0",
  "fixture_set": "legacy_characterization",
  "scenario_id": "GT16",
  "variant_id": "GT16-history",
  "plane": "db_events",
  "applicability": "required",
  "payload_schema": "planes/db-events.schema.json",
  "normalization_profile": "agent-golden-v1",
  "source": {
    "kind": "captured_runtime",
    "repo_revision": "c7fc448da7776c184d43865db392005819dc3b8f",
    "artifacts": [
      {
        "path": "backend/tests/agent_golden/fixture_writer.py",
        "sha256": "sha256:8e1b665180de6ca67c8df40550ee03bed57bd0bb310ca52a8cdc92049345939f"
      },
      {
        "path": "backend/tests/agent_golden/legacy_scenario_capture.py",
        "sha256": "sha256:cb62e624befd3fc3b57692fe4740b3ae8e902f66e2e1e9bf1f295ffd0dc43c74"
      },
      {
        "path": "backend/tests/agent_golden/harness.py",
        "sha256": "sha256:11608df79f9b8576d09262931838b8b2a3905a369abef66cdeb67dcc37d0defd"
      },
      {
        "path": "backend/tests/agent_golden/support.py",
        "sha256": "sha256:dc35bef1b0256844800b6398aa667f08627f1116b768bc710a010331e71c0b94"
      },
      {
        "path": "backend/tests/agent_golden/scripted_dependencies.py",
        "sha256": "sha256:3212379f91898a9d79d50d7e602d1666ad51d4b9fa1dd121bfaee054fa88c1f6"
      },
      {
        "path": "contracts/agent/v1/normalization-profiles.json",
        "sha256": "sha256:12190f7fbc7cef27f8ad4341952cfb46f5a775e28da16529045a2d7dc7ac3bcd"
      },
      {
        "path": "contracts/agent/v1/scenario-catalog.json",
        "sha256": "sha256:9725d8e215fd2b528f0c8bc71a0ca007fa2c60b159856241f9f4ce2dd5fd3daa"
      }
    ],
    "capture_harness": "agent_golden.fixture_writer.capture_legacy_envelopes"
  },
  "legacy_field_observation": {
    "interaction_id": "absent",
    "run_id": "absent"
  },
  "content_hash": "sha256:129697728aa7d0480decbd71b9a59276a3141641d1bf75cf54fe32de75982496",
  "joins": [],
  "happens_before": [
    {
      "name": "user-event-before-assistant-event",
      "rule_id": "legacy.observed_event_order",
      "order_type": "integer",
      "before": {
        "role": "db_user_event_order",
        "plane": "db_events",
        "pointer": "/events/1/observed_row_order"
      },
      "after": {
        "role": "db_assistant_event_order",
        "plane": "db_events",
        "pointer": "/events/7/observed_row_order"
      }
    }
  ],
  "payload": {
    "events": [
      {
        "observed_row_order": 0,
        "event_id": "<id:0005>",
        "event_type": "session_created",
        "tenant_id": "tenant_golden",
        "session_id": "<id:0003>",
        "created_at": "2000-01-01T00:00:00.003Z",
        "payload": {
          "kind": "session_created",
          "sessionId": "<id:0003>",
          "timestamp": "2000-01-01T00:00:00.002Z",
          "provider": "skill",
          "newSessionId": "<id:0003>"
        }
      },
      {
        "observed_row_order": 1,
        "event_id": "<id:0006>",
        "event_type": "user_message_received",
        "tenant_id": "tenant_golden",
        "session_id": "<id:0003>",
        "created_at": "2000-01-01T00:00:00.005Z",
        "payload": {
          "message_id": "<id:0001>",
          "client_turn_id": "client-attachment",
          "message": "请总结附件。",
          "channel": "web",
          "user_id": "user_golden",
          "turn_id": "<id:0001>",
          "user_message_id": "<id:0001>"
        }
      },
      {
        "observed_row_order": 2,
        "event_id": "<id:0007>",
        "event_type": "stream_status",
        "tenant_id": "tenant_golden",
        "session_id": "<id:0003>",
        "created_at": "2000-01-01T00:00:00.006Z",
        "payload": {
          "phase": "routing",
          "text": "正在判断用户意图",
          "user_message_id": "<id:0001>",
          "turn_id": "<id:0001>",
          "client_turn_id": "client-attachment"
        }
      },
      {
        "observed_row_order": 3,
        "event_id": "<id:0008>",
        "event_type": "stream_status",
        "tenant_id": "tenant_golden",
        "session_id": "<id:0003>",
        "created_at": "2000-01-01T00:00:00.007Z",
        "payload": {
          "phase": "responding",
          "text": "正在生成回复",
          "user_message_id": "<id:0001>",
          "turn_id": "<id:0001>",
          "client_turn_id": "client-attachment"
        }
      },
      {
        "observed_row_order": 4,
        "event_id": "<id:0009>",
        "event_type": "stream_delta",
        "tenant_id": "tenant_golden",
        "session_id": "<id:0003>",
        "created_at": "2000-01-01T00:00:00.008Z",
        "payload": {
          "content": "这是 Golden ",
          "user_message_id": "<id:0001>",
          "turn_id": "<id:0001>",
          "client_turn_id": "client-attachment"
        }
      },
      {
        "observed_row_order": 5,
        "event_id": "<id:0010>",
        "event_type": "stream_delta",
        "tenant_id": "tenant_golden",
        "session_id": "<id:0003>",
        "created_at": "2000-01-01T00:00:00.009Z",
        "payload": {
          "content": "测试的稳定回复。",
          "user_message_id": "<id:0001>",
          "turn_id": "<id:0001>",
          "client_turn_id": "client-attachment"
        }
      },
      {
        "observed_row_order": 6,
        "event_id": "<id:0011>",
        "event_type": "stream_end",
        "tenant_id": "tenant_golden",
        "session_id": "<id:0003>",
        "created_at": "2000-01-01T00:00:00.010Z",
        "payload": {
          "user_message_id": "<id:0001>",
          "turn_id": "<id:0001>",
          "client_turn_id": "client-attachment"
        }
      },
      {
        "observed_row_order": 7,
        "event_id": "<id:0012>",
        "event_type": "assistant_message_created",
        "tenant_id": "tenant_golden",
        "session_id": "<id:0003>",
        "created_at": "2000-01-01T00:00:00.013Z",
        "payload": {
          "message_id": "<id:0004>",
          "assistant_message_id": "<id:0004>",
          "reply": "这是 Golden 测试的稳定回复。",
          "user_message_id": "<id:0001>",
          "turn_id": "<id:0001>",
          "client_turn_id": "client-attachment"
        }
      },
      {
        "observed_row_order": 8,
        "event_id": "<id:0013>",
        "event_type": "session_state_changed",
        "tenant_id": "tenant_golden",
        "session_id": "<id:0003>",
        "created_at": "2000-01-01T00:00:00.014Z",
        "payload": {
          "session_id": "<id:0003>",
          "tenant_id": "tenant_golden",
          "user_id": "user_golden",
          "agent_id": "agent_golden",
          "title": "请总结附件",
          "active_skill_id": null,
          "active_step_id": null,
          "slots": {},
          "pending_tasks": [],
          "awaiting_input": null,
          "knowledge_context": [],
          "summary": "最近回复：这是 Golden 测试的稳定回复。",
          "last_agent_question": null,
          "status": "active",
          "turn_id": "<id:0001>",
          "user_message_id": "<id:0001>",
          "client_turn_id": "client-attachment"
        }
      },
      {
        "observed_row_order": 9,
        "event_id": "<id:0014>",
        "event_type": "complete",
        "tenant_id": "tenant_golden",
        "session_id": "<id:0003>",
        "created_at": "2000-01-01T00:00:00.016Z",
        "payload": {
          "kind": "complete",
          "sessionId": "<id:0003>",
          "timestamp": "2000-01-01T00:00:00.015Z",
          "provider": "skill",
          "reply": "这是 Golden 测试的稳定回复。",
          "session_id": "<id:0003>",
          "router_decision": {
            "decision": "answer_only",
            "selected_task_id": null,
            "target_skill_id": null,
            "target_step_id": null,
            "confidence": 0.0,
            "user_intent": null,
            "general_intent": null,
            "reason": "No published scene skills are available; answer as chat.",
            "source_message": null,
            "clarification_question": null,
            "slot_hints": {},
            "task_frames": [],
            "pending_tasks": [],
            "task_updates": [],
            "created_tasks": [],
            "awaiting_input": null
          },
          "step_result": {
            "action": null,
            "reply": null,
            "slot_updates": {},
            "tool_call": null,
            "knowledge_query": null,
            "knowledge_results": [],
            "next_step_id": null,
            "is_step_completed": false,
            "handoff": false
          },
          "tool_result": null,
          "session_state": {
            "session_id": "<id:0003>",
            "tenant_id": "tenant_golden",
            "user_id": "user_golden",
            "agent_id": "agent_golden",
            "title": "请总结附件",
            "active_skill_id": null,
            "active_step_id": null,
            "slots": {},
            "pending_tasks": [],
            "awaiting_input": null,
            "knowledge_context": [],
            "summary": "最近回复：这是 Golden 测试的稳定回复。",
            "last_agent_question": null,
            "status": "active"
          },
          "user_message_id": "<id:0001>",
          "turn_id": "<id:0001>"
        }
      }
    ]
  }
}
