{
  "schema_version": "1.0",
  "fixture_set": "legacy_characterization",
  "scenario_id": "GT16",
  "variant_id": "GT16-history",
  "plane": "conversation",
  "applicability": "required",
  "payload_schema": "planes/conversation.schema.json",
  "normalization_profile": "agent-golden-v1",
  "source": {
    "kind": "captured_runtime",
    "repo_revision": "2a36d3fad208af0ce0d6cfb3bc946d9e858d6145",
    "artifacts": [
      {
        "path": "backend/tests/agent_golden/fixture_writer.py",
        "sha256": "sha256:3784feb44fdc4fb4ee6b54a5ea420d453e82f4d5aaf33e55501b57d2ac118c96"
      },
      {
        "path": "backend/tests/agent_golden/legacy_scenario_capture.py",
        "sha256": "sha256:dafdaa57a89d13163bb61bde9586583ac6d8c9811a7d59b68208c4115115dbc5"
      },
      {
        "path": "backend/tests/agent_golden/harness.py",
        "sha256": "sha256:40f771c8c3ccc1cf59edb2759d04f4ac45de48996583253ffa7038faec128f6b"
      },
      {
        "path": "backend/tests/agent_golden/support.py",
        "sha256": "sha256:dc35bef1b0256844800b6398aa667f08627f1116b768bc710a010331e71c0b94"
      },
      {
        "path": "backend/tests/agent_golden/scripted_dependencies.py",
        "sha256": "sha256:3212379f91898a9d79d50d7e602d1666ad51d4b9fa1dd121bfaee054fa88c1f6"
      },
      {
        "path": "contracts/agent/v1/normalization-profiles.json",
        "sha256": "sha256:2be3a2ad27f6ff312b7ca4b90917eb5cb6c38fd3b401ab7e9a61fea5d0628955"
      },
      {
        "path": "contracts/agent/v1/scenario-catalog.json",
        "sha256": "sha256:9725d8e215fd2b528f0c8bc71a0ca007fa2c60b159856241f9f4ce2dd5fd3daa"
      }
    ],
    "capture_harness": "agent_golden.fixture_writer.capture_legacy_envelopes"
  },
  "legacy_field_observation": {
    "interaction_id": "absent",
    "run_id": "absent"
  },
  "content_hash": "sha256:c1e3af0b7305599e20c60d86b205e3c38838d3e6c758388da8e632b0973c5613",
  "joins": [],
  "happens_before": [],
  "payload": {
    "sync_response": null,
    "messages": [
      {
        "id": "<id:0001>",
        "tenant_id": "tenant_golden",
        "session_id": "<id:0003>",
        "role": "user",
        "content": "请总结附件。",
        "metadata": {
          "client_turn_id": "client-attachment",
          "attachments": [
            {
              "id": "<id:0002>",
              "filename": "golden-notes.txt",
              "content_type": "text/plain",
              "size": 19,
              "kind": "text",
              "text": "第一行\n第二行",
              "preview": "第一行\n第二行",
              "data_url": null,
              "python_summary": "文件 golden-notes.txt，19 bytes，MIME text/plain。 解析得到 7 个字符、2 行、约 2 个词。",
              "error": null
            }
          ]
        },
        "turn_id": "<id:0001>",
        "created_at": "2000-01-01T00:00:00.004Z",
        "feedback_rating": null
      },
      {
        "id": "<id:0004>",
        "tenant_id": "tenant_golden",
        "session_id": "<id:0003>",
        "role": "assistant",
        "content": "这是 Golden 测试的稳定回复。",
        "metadata": {
          "user_message_id": "<id:0001>",
          "turn_id": "<id:0001>"
        },
        "turn_id": "<id:0001>",
        "created_at": "2000-01-01T00:00:00.012Z",
        "feedback_rating": null
      }
    ],
    "session": {
      "id": "<id:0003>",
      "tenant_id": "tenant_golden",
      "user_id": "user_golden",
      "agent_id": "agent_golden",
      "title": "请总结附件",
      "active_skill_id": null,
      "active_step_id": null,
      "status": "active",
      "summary": "最近回复：这是 Golden 测试的稳定回复。",
      "last_agent_question": null,
      "is_scheduled": false,
      "created_at": "2000-01-01T00:00:00.001Z",
      "updated_at": "2000-01-01T00:00:00.011Z"
    },
    "persisted_pre_state": null,
    "persisted_session": {
      "id": "<id:0003>",
      "tenant_id": "tenant_golden",
      "user_id": "user_golden",
      "agent_id": "agent_golden",
      "status": "active",
      "active_skill_id": null,
      "active_step_id": null,
      "slots": {},
      "awaiting_input": null,
      "pending_tasks": [],
      "created_at": "2000-01-01T00:00:00.001Z",
      "updated_at": "2000-01-01T00:00:00.011Z"
    },
    "interaction_checks": [
      {
        "kind": "attachment",
        "realtime_observation": "not_observed",
        "refresh_observation": "history_payload_observed",
        "action_result": {
          "evidence_id": "attachment-history-inspection",
          "evidence_origin": "harness_synthetic",
          "resource_id": "golden-notes.txt",
          "action": "inspect_after_history",
          "request": {
            "filename": "golden-notes.txt"
          },
          "response_status": 200,
          "persisted_state": {
            "attachment": {
              "id": "<id:0002>",
              "filename": "golden-notes.txt",
              "content_type": "text/plain",
              "size": 19,
              "kind": "text",
              "text": "第一行\n第二行",
              "preview": "第一行\n第二行",
              "data_url": null,
              "python_summary": "文件 golden-notes.txt，19 bytes，MIME text/plain。 解析得到 7 个字符、2 行、约 2 个词。",
              "error": null
            }
          }
        }
      }
    ]
  }
}
