{
  "schema_version": "1.0",
  "fixture_set": "legacy_characterization",
  "scenario_id": "GT15",
  "variant_id": "GT15-full",
  "plane": "provider",
  "applicability": "not_applicable",
  "payload_schema": null,
  "normalization_profile": "agent-golden-v1",
  "source": {
    "kind": "explicit_manifest",
    "repo_revision": "6c6594d42c08ae3757a72aa0e654a3fe555e4077",
    "artifacts": [
      {
        "path": "contracts/agent/v1/scenario-catalog.json",
        "sha256": "sha256:9725d8e215fd2b528f0c8bc71a0ca007fa2c60b159856241f9f4ce2dd5fd3daa"
      }
    ],
    "capture_harness": null
  },
  "legacy_field_observation": {
    "interaction_id": "absent",
    "run_id": "absent"
  },
  "content_hash": null,
  "joins": [],
  "happens_before": [],
  "omission": {
    "reason": "provider is not_applicable for GT15-full."
  }
}
