{
  "schema_version": "1.0",
  "fixture_set": "legacy_characterization",
  "scenario_id": "GT03",
  "variant_id": "GT03-false",
  "plane": "domain",
  "applicability": "required",
  "payload_schema": "planes/domain.schema.json",
  "normalization_profile": "agent-golden-v1",
  "source": {
    "kind": "captured_runtime",
    "repo_revision": "ea475130dc3ba6dddd08d3456769d4062f73b75b",
    "artifacts": [
      {
        "path": "backend/tests/agent_golden/fixture_writer.py",
        "sha256": "sha256:3784feb44fdc4fb4ee6b54a5ea420d453e82f4d5aaf33e55501b57d2ac118c96"
      },
      {
        "path": "backend/tests/agent_golden/legacy_scenario_capture.py",
        "sha256": "sha256:dafdaa57a89d13163bb61bde9586583ac6d8c9811a7d59b68208c4115115dbc5"
      },
      {
        "path": "backend/tests/agent_golden/harness.py",
        "sha256": "sha256:40f771c8c3ccc1cf59edb2759d04f4ac45de48996583253ffa7038faec128f6b"
      },
      {
        "path": "backend/tests/agent_golden/support.py",
        "sha256": "sha256:8396ad2520dbeaa8aa4c796c39296dadd5465dc906c9d38596efdc29a6696869"
      },
      {
        "path": "backend/tests/agent_golden/scripted_dependencies.py",
        "sha256": "sha256:3212379f91898a9d79d50d7e602d1666ad51d4b9fa1dd121bfaee054fa88c1f6"
      },
      {
        "path": "contracts/agent/v1/normalization-profiles.json",
        "sha256": "sha256:8439f9fc9f269c0593d1768125ae9eaf71717260df676cc03d0ddf1c6e672c66"
      },
      {
        "path": "contracts/agent/v1/scenario-catalog.json",
        "sha256": "sha256:9725d8e215fd2b528f0c8bc71a0ca007fa2c60b159856241f9f4ce2dd5fd3daa"
      }
    ],
    "capture_harness": "agent_golden.fixture_writer.capture_legacy_envelopes"
  },
  "legacy_field_observation": {
    "interaction_id": "absent",
    "run_id": "absent"
  },
  "content_hash": "sha256:5afaf1e21f0530a1b82f48a54a2439c75a2e739675e2983901e9ca1e86d717b7",
  "joins": [
    {
      "name": "user-turn-message-identity",
      "rule_id": "legacy.turn_message_identity",
      "references": [
        {
          "role": "domain_turn_id",
          "plane": "domain",
          "pointer": "/request/turn_id"
        },
        {
          "role": "db_user_message_id",
          "plane": "db_events",
          "pointer": "/events/0/payload/message_id"
        },
        {
          "role": "conversation_user_message_id",
          "plane": "conversation",
          "pointer": "/messages/0/id"
        }
      ]
    },
    {
      "name": "assistant-message-identity",
      "rule_id": "legacy.turn_message_identity",
      "references": [
        {
          "role": "domain_assistant_message_id",
          "plane": "domain",
          "pointer": "/outcome/assistant_message_id"
        },
        {
          "role": "db_assistant_message_id",
          "plane": "db_events",
          "pointer": "/events/10/payload/message_id"
        },
        {
          "role": "conversation_assistant_message_id",
          "plane": "conversation",
          "pointer": "/messages/1/id"
        }
      ]
    },
    {
      "name": "selected-graph-step-identity",
      "rule_id": "legacy.graph_step_identity",
      "references": [
        {
          "role": "domain_selected_step_id",
          "plane": "domain",
          "pointer": "/facts/0/selected_step_id"
        },
        {
          "role": "db_transition_step_id",
          "plane": "db_events",
          "pointer": "/events/4/payload/to_step_id"
        }
      ]
    }
  ],
  "happens_before": [],
  "payload": {
    "request": {
      "tenant_id": "tenant_golden",
      "agent_id": "agent_golden",
      "message": "审核拒绝。",
      "client_turn_id": "client-gt03-false",
      "turn_id": "<id:0001>",
      "session_id": "<id:0002>"
    },
    "router_decision": {
      "decision": "continue_active",
      "selected_task_id": null,
      "target_skill_id": "skill_conditional_audit",
      "target_step_id": "reject",
      "confidence": 1.0,
      "user_intent": "审核报文",
      "general_intent": null,
      "reason": "SOP 图还有可自动执行的后续节点。",
      "source_message": "审核拒绝。",
      "clarification_question": null,
      "slot_hints": {},
      "task_frames": [],
      "pending_tasks": [],
      "task_updates": [],
      "created_tasks": [],
      "awaiting_input": null
    },
    "step_result": {
      "action": "reply",
      "reply": "审核结果已确认。",
      "slot_updates": {},
      "tool_call": null,
      "knowledge_query": null,
      "knowledge_results": [],
      "next_step_id": null,
      "is_step_completed": true,
      "handoff": false
    },
    "tool_result": null,
    "outcome": {
      "reply": "这是 Golden 测试的稳定回复。",
      "session_id": "<id:0002>",
      "assistant_message_id": "<id:0003>"
    },
    "facts": [
      {
        "kind": "exclusive_graph_branch",
        "observation_source": "session_events_api",
        "selected_step_id": "reject",
        "step_transitions": [
          {
            "from_skill_id": "skill_conditional_audit",
            "to_skill_id": "skill_conditional_audit",
            "from_step_id": "start",
            "to_step_id": "reject",
            "turn_id": "<id:0001>",
            "user_message_id": "<id:0001>",
            "client_turn_id": "client-gt03-false"
          }
        ],
        "pending_step_updates": [
          {
            "pending_step_ids": [],
            "turn_id": "<id:0001>",
            "user_message_id": "<id:0001>",
            "client_turn_id": "client-gt03-false"
          }
        ],
        "llm_phase_order": [
          "json:Router",
          "json:Step Agent",
          "json:Step Agent",
          "json:Reflection",
          "text:Response Generator"
        ]
      }
    ],
    "termination": "sync_response"
  }
}
