{
  "schema_version": "1.0",
  "fixture_set": "legacy_characterization",
  "scenario_id": "GT15",
  "variant_id": "GT15-full",
  "plane": "domain",
  "applicability": "required",
  "payload_schema": "planes/domain.schema.json",
  "normalization_profile": "agent-golden-v1",
  "source": {
    "kind": "captured_runtime",
    "repo_revision": "c7fc448da7776c184d43865db392005819dc3b8f",
    "artifacts": [
      {
        "path": "backend/tests/agent_golden/fixture_writer.py",
        "sha256": "sha256:8e1b665180de6ca67c8df40550ee03bed57bd0bb310ca52a8cdc92049345939f"
      },
      {
        "path": "backend/tests/agent_golden/legacy_scenario_capture.py",
        "sha256": "sha256:cb62e624befd3fc3b57692fe4740b3ae8e902f66e2e1e9bf1f295ffd0dc43c74"
      },
      {
        "path": "backend/tests/agent_golden/harness.py",
        "sha256": "sha256:11608df79f9b8576d09262931838b8b2a3905a369abef66cdeb67dcc37d0defd"
      },
      {
        "path": "backend/tests/agent_golden/support.py",
        "sha256": "sha256:dc35bef1b0256844800b6398aa667f08627f1116b768bc710a010331e71c0b94"
      },
      {
        "path": "backend/tests/agent_golden/scripted_dependencies.py",
        "sha256": "sha256:3212379f91898a9d79d50d7e602d1666ad51d4b9fa1dd121bfaee054fa88c1f6"
      },
      {
        "path": "contracts/agent/v1/normalization-profiles.json",
        "sha256": "sha256:12190f7fbc7cef27f8ad4341952cfb46f5a775e28da16529045a2d7dc7ac3bcd"
      },
      {
        "path": "contracts/agent/v1/scenario-catalog.json",
        "sha256": "sha256:9725d8e215fd2b528f0c8bc71a0ca007fa2c60b159856241f9f4ce2dd5fd3daa"
      }
    ],
    "capture_harness": "agent_golden.fixture_writer.capture_legacy_envelopes"
  },
  "legacy_field_observation": {
    "interaction_id": "absent",
    "run_id": "absent"
  },
  "content_hash": "sha256:d485ed2a67b6d6b533762935b9ad07162a8e9c9a28390d0972179dabe164ae08",
  "joins": [
    {
      "name": "user-turn-message-identity",
      "rule_id": "legacy.turn_message_identity",
      "references": [
        {
          "role": "domain_turn_id",
          "plane": "domain",
          "pointer": "/request/turn_id"
        },
        {
          "role": "db_user_message_id",
          "plane": "db_events",
          "pointer": "/events/5/payload/message_id"
        },
        {
          "role": "conversation_user_message_id",
          "plane": "conversation",
          "pointer": "/messages/2/id"
        }
      ]
    },
    {
      "name": "assistant-message-identity",
      "rule_id": "legacy.turn_message_identity",
      "references": [
        {
          "role": "domain_assistant_message_id",
          "plane": "domain",
          "pointer": "/outcome/assistant_message_id"
        },
        {
          "role": "db_assistant_message_id",
          "plane": "db_events",
          "pointer": "/events/10/payload/message_id"
        },
        {
          "role": "conversation_assistant_message_id",
          "plane": "conversation",
          "pointer": "/messages/3/id"
        }
      ]
    }
  ],
  "happens_before": [],
  "payload": {
    "request": {
      "tenant_id": "tenant_golden",
      "agent_id": "agent_golden",
      "message": "每天九点检查 A1 价格。",
      "client_turn_id": "client-draft",
      "turn_id": "<id:0001>",
      "session_id": "<id:0002>",
      "interaction_mode": "scheduled_task",
      "client_timezone": "Asia/Shanghai"
    },
    "router_decision": null,
    "step_result": null,
    "tool_result": null,
    "outcome": {
      "reply": "我已按你选择的定时项目整理成自动任务草案。\n任务：每日检查价格\n计划：每天 09:00\n执行内容：检查 A1 价格并汇总\n确认下方卡片后才会启用；确认前不会创建自动任务。",
      "session_id": "<id:0002>",
      "assistant_message_id": "<id:0003>"
    },
    "facts": [],
    "termination": "complete"
  }
}
