{
  "schema_version": "1.0",
  "fixture_set": "legacy_characterization",
  "scenario_id": "GT03",
  "variant_id": "GT03-true",
  "plane": "conversation",
  "applicability": "required",
  "payload_schema": "planes/conversation.schema.json",
  "normalization_profile": "agent-golden-v1",
  "source": {
    "kind": "captured_runtime",
    "repo_revision": "ea475130dc3ba6dddd08d3456769d4062f73b75b",
    "artifacts": [
      {
        "path": "backend/tests/agent_golden/fixture_writer.py",
        "sha256": "sha256:3784feb44fdc4fb4ee6b54a5ea420d453e82f4d5aaf33e55501b57d2ac118c96"
      },
      {
        "path": "backend/tests/agent_golden/legacy_scenario_capture.py",
        "sha256": "sha256:dafdaa57a89d13163bb61bde9586583ac6d8c9811a7d59b68208c4115115dbc5"
      },
      {
        "path": "backend/tests/agent_golden/harness.py",
        "sha256": "sha256:40f771c8c3ccc1cf59edb2759d04f4ac45de48996583253ffa7038faec128f6b"
      },
      {
        "path": "backend/tests/agent_golden/support.py",
        "sha256": "sha256:8396ad2520dbeaa8aa4c796c39296dadd5465dc906c9d38596efdc29a6696869"
      },
      {
        "path": "backend/tests/agent_golden/scripted_dependencies.py",
        "sha256": "sha256:3212379f91898a9d79d50d7e602d1666ad51d4b9fa1dd121bfaee054fa88c1f6"
      },
      {
        "path": "contracts/agent/v1/normalization-profiles.json",
        "sha256": "sha256:8439f9fc9f269c0593d1768125ae9eaf71717260df676cc03d0ddf1c6e672c66"
      },
      {
        "path": "contracts/agent/v1/scenario-catalog.json",
        "sha256": "sha256:9725d8e215fd2b528f0c8bc71a0ca007fa2c60b159856241f9f4ce2dd5fd3daa"
      }
    ],
    "capture_harness": "agent_golden.fixture_writer.capture_legacy_envelopes"
  },
  "legacy_field_observation": {
    "interaction_id": "absent",
    "run_id": "absent"
  },
  "content_hash": "sha256:5cb286cb7a7b04b91a90c4a3574a40e0be497ad34f8947efb6d2d4b33193f0f0",
  "joins": [],
  "happens_before": [],
  "payload": {
    "sync_response": {
      "reply": "这是 Golden 测试的稳定回复。",
      "session_id": "<id:0002>",
      "router_decision": {
        "decision": "continue_active",
        "selected_task_id": null,
        "target_skill_id": "skill_conditional_audit",
        "target_step_id": "approve",
        "confidence": 1.0,
        "user_intent": "审核报文",
        "general_intent": null,
        "reason": "SOP 图还有可自动执行的后续节点。",
        "source_message": "审核通过。",
        "clarification_question": null,
        "slot_hints": {},
        "task_frames": [],
        "pending_tasks": [],
        "task_updates": [],
        "created_tasks": [],
        "awaiting_input": null
      },
      "step_result": {
        "action": "reply",
        "reply": "审核结果已确认。",
        "slot_updates": {},
        "tool_call": null,
        "knowledge_query": null,
        "knowledge_results": [],
        "next_step_id": null,
        "is_step_completed": true,
        "handoff": false
      },
      "tool_result": null,
      "session_state": {
        "session_id": "<id:0002>",
        "tenant_id": "tenant_golden",
        "user_id": "user_golden",
        "agent_id": "agent_golden",
        "title": "审核通过",
        "active_skill_id": null,
        "active_step_id": null,
        "slots": {},
        "pending_tasks": [],
        "awaiting_input": null,
        "knowledge_context": [],
        "summary": "最近回复：这是 Golden 测试的稳定回复。",
        "last_agent_question": null,
        "status": "active"
      }
    },
    "messages": [
      {
        "id": "<id:0001>",
        "tenant_id": "tenant_golden",
        "session_id": "<id:0002>",
        "role": "user",
        "content": "审核通过。",
        "metadata": {
          "client_turn_id": "client-gt03-true"
        },
        "turn_id": "<id:0001>",
        "created_at": "2000-01-01T00:00:00.003Z",
        "feedback_rating": null
      },
      {
        "id": "<id:0003>",
        "tenant_id": "tenant_golden",
        "session_id": "<id:0002>",
        "role": "assistant",
        "content": "这是 Golden 测试的稳定回复。",
        "metadata": {
          "user_message_id": "<id:0001>",
          "turn_id": "<id:0001>"
        },
        "turn_id": "<id:0001>",
        "created_at": "2000-01-01T00:00:00.015Z",
        "feedback_rating": null
      }
    ],
    "session": {
      "id": "<id:0002>",
      "tenant_id": "tenant_golden",
      "user_id": "user_golden",
      "agent_id": "agent_golden",
      "title": "审核通过",
      "active_skill_id": null,
      "active_step_id": null,
      "status": "active",
      "summary": "最近回复：这是 Golden 测试的稳定回复。",
      "last_agent_question": null,
      "is_scheduled": false,
      "created_at": "2000-01-01T00:00:00.001Z",
      "updated_at": "2000-01-01T00:00:00.014Z"
    },
    "persisted_pre_state": {
      "id": "<id:0002>",
      "tenant_id": "tenant_golden",
      "user_id": "user_golden",
      "agent_id": "agent_golden",
      "status": "active",
      "active_skill_id": "skill_conditional_audit",
      "active_step_id": "start",
      "slots": {},
      "awaiting_input": null,
      "pending_tasks": [],
      "created_at": "2000-01-01T00:00:00.001Z",
      "updated_at": "2000-01-01T00:00:00.002Z"
    },
    "persisted_session": {
      "id": "<id:0002>",
      "tenant_id": "tenant_golden",
      "user_id": "user_golden",
      "agent_id": "agent_golden",
      "status": "active",
      "active_skill_id": null,
      "active_step_id": null,
      "slots": {},
      "awaiting_input": null,
      "pending_tasks": [],
      "created_at": "2000-01-01T00:00:00.001Z",
      "updated_at": "2000-01-01T00:00:00.014Z"
    },
    "interaction_checks": [
      {
        "kind": "none",
        "realtime_observation": "not_observed",
        "refresh_observation": "not_observed",
        "action_result": null
      }
    ]
  }
}
