{
  "schema_version": "1.0",
  "fixture_set": "legacy_characterization",
  "scenario_id": "GT02",
  "variant_id": "GT02-ask-refresh-continue",
  "plane": "domain",
  "applicability": "required",
  "payload_schema": "planes/domain.schema.json",
  "normalization_profile": "agent-golden-v1",
  "source": {
    "kind": "captured_runtime",
    "repo_revision": "c7fc448da7776c184d43865db392005819dc3b8f",
    "artifacts": [
      {
        "path": "backend/tests/agent_golden/fixture_writer.py",
        "sha256": "sha256:8e1b665180de6ca67c8df40550ee03bed57bd0bb310ca52a8cdc92049345939f"
      },
      {
        "path": "backend/tests/agent_golden/legacy_scenario_capture.py",
        "sha256": "sha256:cb62e624befd3fc3b57692fe4740b3ae8e902f66e2e1e9bf1f295ffd0dc43c74"
      },
      {
        "path": "backend/tests/agent_golden/harness.py",
        "sha256": "sha256:11608df79f9b8576d09262931838b8b2a3905a369abef66cdeb67dcc37d0defd"
      },
      {
        "path": "backend/tests/agent_golden/support.py",
        "sha256": "sha256:dc35bef1b0256844800b6398aa667f08627f1116b768bc710a010331e71c0b94"
      },
      {
        "path": "backend/tests/agent_golden/scripted_dependencies.py",
        "sha256": "sha256:3212379f91898a9d79d50d7e602d1666ad51d4b9fa1dd121bfaee054fa88c1f6"
      },
      {
        "path": "contracts/agent/v1/normalization-profiles.json",
        "sha256": "sha256:12190f7fbc7cef27f8ad4341952cfb46f5a775e28da16529045a2d7dc7ac3bcd"
      },
      {
        "path": "contracts/agent/v1/scenario-catalog.json",
        "sha256": "sha256:9725d8e215fd2b528f0c8bc71a0ca007fa2c60b159856241f9f4ce2dd5fd3daa"
      }
    ],
    "capture_harness": "agent_golden.fixture_writer.capture_legacy_envelopes"
  },
  "legacy_field_observation": {
    "interaction_id": "absent",
    "run_id": "absent"
  },
  "content_hash": "sha256:28df73273c91fac988f504101569ef1835a19b119e2e2bd7399330e4936e5a05",
  "joins": [
    {
      "name": "user-turn-message-identity",
      "rule_id": "legacy.turn_message_identity",
      "references": [
        {
          "role": "domain_turn_id",
          "plane": "domain",
          "pointer": "/request/turn_id"
        },
        {
          "role": "db_user_message_id",
          "plane": "db_events",
          "pointer": "/events/21/payload/message_id"
        },
        {
          "role": "conversation_user_message_id",
          "plane": "conversation",
          "pointer": "/messages/2/id"
        }
      ]
    },
    {
      "name": "assistant-message-identity",
      "rule_id": "legacy.turn_message_identity",
      "references": [
        {
          "role": "domain_assistant_message_id",
          "plane": "domain",
          "pointer": "/outcome/assistant_message_id"
        },
        {
          "role": "db_assistant_message_id",
          "plane": "db_events",
          "pointer": "/events/38/payload/message_id"
        },
        {
          "role": "conversation_assistant_message_id",
          "plane": "conversation",
          "pointer": "/messages/3/id"
        }
      ]
    }
  ],
  "happens_before": [],
  "payload": {
    "request": {
      "tenant_id": "tenant_golden",
      "agent_id": "agent_golden",
      "message": "我是小明，要买两件。",
      "client_turn_id": "client-gt02-continue",
      "turn_id": "<id:0001>",
      "session_id": "<id:0002>"
    },
    "router_decision": {
      "decision": "continue_active",
      "selected_task_id": null,
      "target_skill_id": "skill_purchase_001",
      "target_step_id": "collect_user_name",
      "confidence": 1.0,
      "user_intent": "补充购买信息",
      "general_intent": null,
      "reason": "Continue purchase flow after refresh.",
      "source_message": null,
      "clarification_question": null,
      "slot_hints": {},
      "task_frames": [
        {
          "task_id": null,
          "status": "pending",
          "decision": "continue_active",
          "target_skill_id": "skill_purchase_001",
          "target_step_id": "collect_user_name",
          "confidence": 1.0,
          "user_intent": "补充购买信息",
          "reason": "Continue purchase flow after refresh.",
          "source_message": null,
          "slot_hints": {}
        }
      ],
      "pending_tasks": [],
      "task_updates": [],
      "created_tasks": [],
      "awaiting_input": null
    },
    "step_result": {
      "action": "ask_user",
      "reply": "请确认：小明购买 A1 两件，是否下单？",
      "slot_updates": {
        "user_name": "小明",
        "product_id": "A1",
        "quantity": 2
      },
      "tool_call": null,
      "knowledge_query": null,
      "knowledge_results": [],
      "next_step_id": "confirm_purchase",
      "is_step_completed": false,
      "handoff": false
    },
    "tool_result": null,
    "outcome": {
      "reply": "请确认：小明购买 A1 两件，是否下单？",
      "session_id": "<id:0002>",
      "assistant_message_id": "<id:0003>"
    },
    "facts": [
      {
        "kind": "first_turn_refresh_state",
        "first_turn_terminal": "complete",
        "assistant_reply": "请告诉我您的姓名和购买数量。",
        "active_skill_id": "skill_purchase_001",
        "active_step_id": "collect_user_name",
        "awaiting_input": null
      }
    ],
    "termination": "complete"
  }
}
