{
  "schema_version": "1.0",
  "fixture_set": "legacy_characterization",
  "scenario_id": "GT02",
  "variant_id": "GT02-ask-refresh-continue",
  "plane": "conversation",
  "applicability": "required",
  "payload_schema": "planes/conversation.schema.json",
  "normalization_profile": "agent-golden-v1",
  "source": {
    "kind": "captured_runtime",
    "repo_revision": "ea475130dc3ba6dddd08d3456769d4062f73b75b",
    "artifacts": [
      {
        "path": "backend/tests/agent_golden/fixture_writer.py",
        "sha256": "sha256:3784feb44fdc4fb4ee6b54a5ea420d453e82f4d5aaf33e55501b57d2ac118c96"
      },
      {
        "path": "backend/tests/agent_golden/legacy_scenario_capture.py",
        "sha256": "sha256:dafdaa57a89d13163bb61bde9586583ac6d8c9811a7d59b68208c4115115dbc5"
      },
      {
        "path": "backend/tests/agent_golden/harness.py",
        "sha256": "sha256:40f771c8c3ccc1cf59edb2759d04f4ac45de48996583253ffa7038faec128f6b"
      },
      {
        "path": "backend/tests/agent_golden/support.py",
        "sha256": "sha256:8396ad2520dbeaa8aa4c796c39296dadd5465dc906c9d38596efdc29a6696869"
      },
      {
        "path": "backend/tests/agent_golden/scripted_dependencies.py",
        "sha256": "sha256:3212379f91898a9d79d50d7e602d1666ad51d4b9fa1dd121bfaee054fa88c1f6"
      },
      {
        "path": "contracts/agent/v1/normalization-profiles.json",
        "sha256": "sha256:8439f9fc9f269c0593d1768125ae9eaf71717260df676cc03d0ddf1c6e672c66"
      },
      {
        "path": "contracts/agent/v1/scenario-catalog.json",
        "sha256": "sha256:9725d8e215fd2b528f0c8bc71a0ca007fa2c60b159856241f9f4ce2dd5fd3daa"
      }
    ],
    "capture_harness": "agent_golden.fixture_writer.capture_legacy_envelopes"
  },
  "legacy_field_observation": {
    "interaction_id": "absent",
    "run_id": "absent"
  },
  "content_hash": "sha256:cb8c2d922e856c00e06928950a93509e4a8a1b6ef78e6760d74d1c41b21628e3",
  "joins": [],
  "happens_before": [],
  "payload": {
    "sync_response": null,
    "messages": [
      {
        "id": "<id:0027>",
        "tenant_id": "tenant_golden",
        "session_id": "<id:0002>",
        "role": "user",
        "content": "我要购买 A1。",
        "metadata": {
          "client_turn_id": "client-gt02-ask"
        },
        "turn_id": "<id:0027>",
        "created_at": "2000-01-01T00:00:00.004Z",
        "feedback_rating": null
      },
      {
        "id": "<id:0044>",
        "tenant_id": "tenant_golden",
        "session_id": "<id:0002>",
        "role": "assistant",
        "content": "请告诉我您的姓名和购买数量。",
        "metadata": {
          "user_message_id": "<id:0027>",
          "turn_id": "<id:0027>"
        },
        "turn_id": "<id:0027>",
        "created_at": "2000-01-01T00:00:00.021Z",
        "feedback_rating": null
      },
      {
        "id": "<id:0001>",
        "tenant_id": "tenant_golden",
        "session_id": "<id:0002>",
        "role": "user",
        "content": "我是小明，要买两件。",
        "metadata": {
          "client_turn_id": "client-gt02-continue"
        },
        "turn_id": "<id:0001>",
        "created_at": "2000-01-01T00:00:00.028Z",
        "feedback_rating": null
      },
      {
        "id": "<id:0003>",
        "tenant_id": "tenant_golden",
        "session_id": "<id:0002>",
        "role": "assistant",
        "content": "请确认：小明购买 A1 两件，是否下单？",
        "metadata": {
          "user_message_id": "<id:0001>",
          "turn_id": "<id:0001>"
        },
        "turn_id": "<id:0001>",
        "created_at": "2000-01-01T00:00:00.047Z",
        "feedback_rating": null
      }
    ],
    "session": {
      "id": "<id:0002>",
      "tenant_id": "tenant_golden",
      "user_id": "user_golden",
      "agent_id": "agent_golden",
      "title": "我要购买 A1",
      "active_skill_id": "skill_purchase_001",
      "active_step_id": "confirm_purchase",
      "status": "active",
      "summary": "最近回复：请确认：小明购买 A1 两件，是否下单？",
      "last_agent_question": "请确认：小明购买 A1 两件，是否下单？",
      "is_scheduled": false,
      "created_at": "2000-01-01T00:00:00.001Z",
      "updated_at": "2000-01-01T00:00:00.046Z"
    },
    "persisted_pre_state": null,
    "persisted_session": {
      "id": "<id:0002>",
      "tenant_id": "tenant_golden",
      "user_id": "user_golden",
      "agent_id": "agent_golden",
      "status": "active",
      "active_skill_id": "skill_purchase_001",
      "active_step_id": "confirm_purchase",
      "slots": {
        "product_id": "A1",
        "user_name": "小明",
        "quantity": 2
      },
      "awaiting_input": {
        "skill_id": "skill_purchase_001",
        "step_id": "confirm_purchase",
        "expected_fields": [
          "purchase_confirmed"
        ],
        "question_summary": "请确认：小明购买 A1 两件，是否下单？"
      },
      "pending_tasks": [],
      "created_at": "2000-01-01T00:00:00.001Z",
      "updated_at": "2000-01-01T00:00:00.046Z"
    },
    "interaction_checks": [
      {
        "kind": "none",
        "realtime_observation": "not_observed",
        "refresh_observation": "not_observed",
        "action_result": null
      }
    ]
  }
}
